{
  "access_metadata": {
    "resolver": "artifact-store"
  },
  "content": {
    "arrow_mapping_schema_version": 1,
    "canonical_encoding_version": 1,
    "content_schema_id": "gateway-vnext.canonical-row-hash.canonical-row-hashes-artifact.v1",
    "contract_binding": {
      "contract_id": "gateway-vnext.canonical-row-hash-compute-boundary",
      "semantic_version": "1.0.0"
    },
    "media_type": "application/vnd.apache.arrow.stream",
    "raw_content_digest": "sha256:1111111111111111111111111111111111111111111111111111111111111111",
    "result_schema_version": 1,
    "row_count": "0",
    "table_schema_digest": "sha256:2222222222222222222222222222222222222222222222222222222222222222"
  },
  "content_contract": {
    "contract_id": "gateway-vnext.canonical-row-hash-compute-boundary",
    "semantic_version": "1.0.0"
  },
  "content_digest": "sha256:1111111111111111111111111111111111111111111111111111111111111111",
  "content_schema_id": "gateway-vnext.canonical-row-hash.canonical-row-hashes-artifact.v1",
  "logical_ref": "gateway-vnext.artifacts/v1/ref/canonical-row-hash/example-0001",
  "manifest_schema_version": 1,
  "media_type": "application/vnd.apache.arrow.stream",
  "raw_sha256": "sha256:257a0191a8f55365597b56b691ef9608a86034a9226dff5f06c6b84029ed8ac5",
  "retention_class": "operation",
  "size_bytes": 27
}
